{
  "schema_version": "1.0",
  "generated_at": "2026-05-01T00:00:00",
  "source": {
    "kind": "local_fixture",
    "path": "tests/synthetic/source/materials.synthetic.json",
    "note": "**完全合成**的素材库：虚构公司、虚构项目、虚构证件号，用于公开环境下的端到端演示与测试。"
  },
  "materials": [
    {
      "material_id": "M-LIC-001",
      "category": "营业执照",
      "title": "营业执照（兴远智联水务科技有限公司）",
      "company": "兴远智联水务科技有限公司",
      "person": null,
      "certificate_number": "91110000SYNTH0001X",
      "issue_date": null,
      "expiry_date": null,
      "contract_party": null,
      "contract_date": null,
      "contract_amount": null,
      "voltage_level": null,
      "voltage_level_kv": null,
      "project_type": null,
      "keywords": ["统一社会信用代码", "注册资本"],
      "verification_status": "VERIFIED",
      "source_file": "tests/synthetic/source/materials.synthetic.json",
      "source_pages": ["附件一"],
      "evidence_spans": [
        {
          "label": "主体信息（合成）",
          "text": "兴远智联水务科技有限公司，统一社会信用代码 91110000SYNTH0001X。",
          "source_ref": "合成素材 A-1"
        }
      ],
      "notes": "合成数据。"
    },
    {
      "material_id": "M-CERT-001",
      "category": "资质证书_施工总承包",
      "title": "建筑业企业资质证书（电子与智能化工程专业承包贰级）",
      "company": "兴远智联水务科技有限公司",
      "person": null,
      "certificate_number": "D0000SAMPLE001",
      "issue_date": null,
      "expiry_date": "2029-06-30",
      "contract_party": null,
      "contract_date": null,
      "contract_amount": null,
      "voltage_level": null,
      "voltage_level_kv": null,
      "project_type": null,
      "keywords": ["电子与智能化工程专业承包贰级"],
      "verification_status": "VERIFIED",
      "source_file": "tests/synthetic/source/materials.synthetic.json",
      "source_pages": ["附件二"],
      "evidence_spans": [
        {
          "label": "资质等级（合成）",
          "text": "资质类别及等级：电子与智能化工程专业承包贰级，有效期至 2029 年 06 月 30 日。",
          "source_ref": "合成素材 A-2"
        }
      ],
      "notes": "合成数据。等级写作『贰级』，比对时需与『二级』等价。"
    },
    {
      "material_id": "M-CERT-002",
      "category": "安全生产许可证",
      "title": "安全生产许可证",
      "company": "兴远智联水务科技有限公司",
      "person": null,
      "certificate_number": "SYNTH-SAFETY-PROD-2025-001",
      "issue_date": "2025-03-01",
      "expiry_date": "2028-03-01",
      "contract_party": null,
      "contract_date": null,
      "contract_amount": null,
      "voltage_level": null,
      "voltage_level_kv": null,
      "project_type": null,
      "keywords": ["建筑施工"],
      "verification_status": "VERIFIED",
      "source_file": "tests/synthetic/source/materials.synthetic.json",
      "source_pages": ["附件三"],
      "evidence_spans": [
        {
          "label": "许可范围与有效期（合成）",
          "text": "安全生产许可证，许可范围：建筑施工，有效期自 2025 年 03 月 01 日起至 2028 年 03 月 01 日止。",
          "source_ref": "合成素材 A-3"
        }
      ],
      "notes": "合成数据。有效期覆盖本项目投标截止日。"
    },
    {
      "material_id": "M-PERF-001",
      "category": "业绩合同",
      "title": "（合成）某园区供水管网压力监测终端供电与通信改造合同",
      "company": "兴远智联水务科技有限公司",
      "person": null,
      "certificate_number": "HT-2024-SYNTH-001",
      "issue_date": null,
      "expiry_date": null,
      "contract_party": "（合成）某园区管理委员会",
      "contract_date": "2024-08-15",
      "contract_amount": "88.0万元",
      "voltage_level": "10kV",
      "voltage_level_kv": 10,
      "project_type": "监测终端供电与通信改造、检修维护",
      "keywords": ["10kV", "监测终端", "改造", "检修"],
      "verification_status": "VERIFIED",
      "source_file": "tests/synthetic/source/materials.synthetic.json",
      "source_pages": ["合成业绩 1"],
      "evidence_spans": [
        {
          "label": "合同封面（合成）",
          "text": "合同编号：HT-2024-SYNTH-001；买方（甲方）：（合成）某园区管理委员会；卖方（乙方）：兴远智联水务科技有限公司；签订日期：2024年8月15日。",
          "source_ref": "合成业绩 1 封面"
        },
        {
          "label": "服务范围（工作对象与电压等级，合成）",
          "text": "服务范围包含 10kV 供电线路及监测终端设备改造，含压力监测终端 60 台及二次设备维护。",
          "source_ref": "合成业绩 1 正文"
        },
        {
          "label": "责任条款（工作性质，合成）",
          "text": "乙方负责设备 24 小时维护、检修、定检及故障维修服务。",
          "source_ref": "合成业绩 1 责任条款"
        }
      ],
      "notes": "合成数据。用于演示五要素全部满足的情形。"
    },
    {
      "material_id": "M-PERF-002",
      "category": "业绩合同",
      "title": "（合成）某水厂供水管网监测终端通信改造及维修合同",
      "company": "兴远智联水务科技有限公司",
      "person": null,
      "certificate_number": "HT-2024-SYNTH-002",
      "issue_date": null,
      "expiry_date": null,
      "contract_party": "（合成）某自来水有限公司",
      "contract_date": "2024-11-20",
      "contract_amount": "46.5万元",
      "voltage_level": "10kV",
      "voltage_level_kv": 10,
      "project_type": "监测终端通信改造、故障维修",
      "keywords": ["10kV", "监测终端", "改造", "维修"],
      "verification_status": "VERIFIED",
      "source_file": "tests/synthetic/source/materials.synthetic.json",
      "source_pages": ["合成业绩 2"],
      "evidence_spans": [
        {
          "label": "合同封面（合成）",
          "text": "合同编号：HT-2024-SYNTH-002；甲方：（合成）某自来水有限公司；乙方：兴远智联水务科技有限公司；签订日期：2024年11月20日。",
          "source_ref": "合成业绩 2 封面"
        },
        {
          "label": "服务范围（合成）",
          "text": "对厂区供水管网监测终端及 10kV 供电回路进行改造，并承担改造后两年的故障维修。",
          "source_ref": "合成业绩 2 正文"
        }
      ],
      "notes": "合成数据。五要素同样满足；与 M-PERF-001 一起演示『资格占用 vs 评分新增』的区别。"
    },
    {
      "material_id": "M-PERF-091",
      "category": "业绩合同",
      "title": "（合成）某新建供水加压泵站工程（新建类，用于演示不满足）",
      "company": "兴远智联水务科技有限公司",
      "person": null,
      "certificate_number": "HT-2023-SYNTH-091",
      "issue_date": null,
      "expiry_date": null,
      "contract_party": "（合成）某镇人民政府",
      "contract_date": "2023-04-10",
      "contract_amount": "560.0万元",
      "voltage_level": "10kV",
      "voltage_level_kv": 10,
      "project_type": "新建加压泵站及配电工程",
      "keywords": ["新建", "泵站", "工程"],
      "verification_status": "REJECTED",
      "source_file": "tests/synthetic/source/materials.synthetic.json",
      "source_pages": ["合成业绩 91"],
      "evidence_spans": [
        {
          "label": "工程内容（新建，合成）",
          "text": "新建供水加压泵站一座，新建 10kV 配电室一座，具体施工内容见工程量清单。",
          "source_ref": "合成业绩 91 正文"
        },
        {
          "label": "价款条款（性质为新建，合成）",
          "text": "10kV 配电室新建工程部分……¥1,860,000。",
          "source_ref": "合成业绩 91 价款页"
        }
      ],
      "notes": "合成数据。用于演示『新建/安装』不得扩张解释为『改造或维修』，也不得因对象不符而误判满足。"
    },
    {
      "material_id": "M-PER-001",
      "category": "人员证书",
      "title": "（合成）项目经理——二级建造师注册证书（机电工程）",
      "company": "兴远智联水务科技有限公司",
      "person": "（合成）张工",
      "certificate_number": "SAMPLE-JZS-000001",
      "issue_date": "2024-01-10",
      "expiry_date": "2027-01-09",
      "contract_party": null,
      "contract_date": null,
      "contract_amount": null,
      "voltage_level": null,
      "voltage_level_kv": null,
      "project_type": "拟任项目经理",
      "keywords": ["二级建造师", "机电工程"],
      "verification_status": "VERIFIED",
      "source_file": "tests/synthetic/source/materials.synthetic.json",
      "source_pages": ["合成人员 1"],
      "evidence_spans": [],
      "notes": "合成数据。"
    },
    {
      "material_id": "M-PER-900",
      "category": "人员证书",
      "title": "（合成）特种作业操作证（低压电工）——待提供",
      "company": "兴远智联水务科技有限公司",
      "person": null,
      "certificate_number": null,
      "issue_date": null,
      "expiry_date": null,
      "contract_party": null,
      "contract_date": null,
      "contract_amount": null,
      "voltage_level": null,
      "voltage_level_kv": null,
      "project_type": "现场作业人员",
      "keywords": ["特种作业操作证", "低压电工"],
      "verification_status": "PENDING_COMPANY",
      "source_file": null,
      "source_pages": [],
      "evidence_spans": [],
      "notes": "合成数据。演示『待公司提供』：不得成为 PASS 候选。"
    },
    {
      "material_id": "M-FIN-2023",
      "category": "财务审计报告",
      "title": "（合成）2023年度审计报告",
      "company": "兴远智联水务科技有限公司",
      "person": null,
      "certificate_number": "SAMPLE-AUDIT-2023",
      "issue_date": "2024-03-05",
      "expiry_date": null,
      "contract_party": null,
      "contract_date": null,
      "contract_amount": null,
      "voltage_level": null,
      "voltage_level_kv": null,
      "project_type": "年度财务报表审计",
      "keywords": ["2023年度"],
      "verification_status": "VERIFIED",
      "source_file": "tests/synthetic/source/materials.synthetic.json",
      "source_pages": ["合成财务 2023"],
      "evidence_spans": [],
      "notes": "合成数据。"
    },
    {
      "material_id": "M-FIN-2024",
      "category": "财务审计报告",
      "title": "（合成）2024年度审计报告",
      "company": "兴远智联水务科技有限公司",
      "person": null,
      "certificate_number": "SAMPLE-AUDIT-2024",
      "issue_date": "2025-03-05",
      "expiry_date": null,
      "contract_party": null,
      "contract_date": null,
      "contract_amount": null,
      "voltage_level": null,
      "voltage_level_kv": null,
      "project_type": "年度财务报表审计",
      "keywords": ["2024年度"],
      "verification_status": "VERIFIED",
      "source_file": "tests/synthetic/source/materials.synthetic.json",
      "source_pages": ["合成财务 2024"],
      "evidence_spans": [],
      "notes": "合成数据。"
    },
    {
      "material_id": "M-FIN-2025",
      "category": "财务审计报告",
      "title": "（合成）2025年度审计报告",
      "company": "兴远智联水务科技有限公司",
      "person": null,
      "certificate_number": "SAMPLE-AUDIT-2025",
      "issue_date": "2026-03-05",
      "expiry_date": null,
      "contract_party": null,
      "contract_date": null,
      "contract_amount": null,
      "voltage_level": null,
      "voltage_level_kv": null,
      "project_type": "年度财务报表审计",
      "keywords": ["2025年度"],
      "verification_status": "VERIFIED",
      "source_file": "tests/synthetic/source/materials.synthetic.json",
      "source_pages": ["合成财务 2025"],
      "evidence_spans": [],
      "notes": "合成数据。"
    },
    {
      "material_id": "M-CREDIT-001",
      "category": "信用查询",
      "title": "（合成）中国执行信息公开网失信被执行人查询结果",
      "company": "兴远智联水务科技有限公司",
      "person": null,
      "certificate_number": null,
      "issue_date": "2026-06-01",
      "expiry_date": null,